{
  "started_at": null,
  "ended_at": "2026-06-06T15:17:33.098Z",
  "step_count": 0,
  "resolved": [
    {
      "finding_id": "F1",
      "summary": "Unknown"
    }
  ],
  "verified_no_change": [],
  "inappropriate": [],
  "ignored": [],
  "blocked": [],
  "combined_test_result": {
    "passed": true,
    "suite_name": "node -e \"process.exit(0)\"",
    "duration_ms": 60
  },
  "closing_result": {
    "action": "none",
    "status": "skipped",
    "commands": []
  }
}
